{
  "schemaVersion": "1.0",
  "id": "anxious-talker",
  "name": "Тревожный говорун",
  "traits": {
    "anxiety": "high",
    "verbosity": "verbose",
    "openness": "forthcoming",
    "trust": "neutral",
    "healthLiteracy": "low"
  },
  "hiddenAgenda": [
    "Склонен преувеличивать тяжесть симптомов из-за страха.",
    "Подозревает у себя «что-то серьёзное» и ждёт опровержения."
  ],
  "speechQuirks": [
    "Перескакивает с темы на тему.",
    "Часто переспрашивает «это ведь не опасно?»."
  ],
  "description": "Тревожный пациент, говорит много и сбивчиво, охотно делится деталями, но окрашивает их страхом. Медицинских терминов почти не использует, описывает ощущения бытовым языком. Доверяет врачу умеренно — нуждается в том, чтобы его успокоили и объяснили."
}
